{
 "purpose": "vision",
 "model_id": "gemini-3.1-flash-lite",
 "response": {
  "depicted_object": "A package of roasted coffee beans",
  "depicted_category": "Coffee",
  "advertised_category": "Coffee",
  "matches": "yes",
  "confidence": 1,
  "reason": "The image shows a retail package of coffee, which directly corresponds to the advertised product category of 'Röstkaffee' (roasted coffee)."
 },
 "usage": {
  "calls": 1,
  "input_tokens": 2364,
  "output_tokens": 201,
  "thinking_tokens": 181
 },
 "recorded_at": "2026-10-09T09:15:38+00:00"
}