{
 "purpose": "vision",
 "model_id": "gemini-3.1-flash-lite",
 "response": {
  "depicted_object": "eggplant",
  "depicted_category": "vegetable",
  "advertised_category": "chocolate",
  "matches": "no",
  "confidence": 1,
  "reason": "The image depicts a fresh eggplant, which is a vegetable, while the advertised product is chocolate."
 },
 "usage": {
  "calls": 1,
  "input_tokens": 4779,
  "output_tokens": 379,
  "thinking_tokens": 0
 },
 "recorded_at": "2026-10-09T09:14:20+00:00"
}