{
 "purpose": "vision",
 "model_id": "gemini-3.1-flash-lite",
 "response": {
  "depicted_object": "A frozen pizza with salami toppings",
  "depicted_category": "frozen pizza",
  "advertised_category": "frozen pizza",
  "matches": "yes",
  "confidence": 1,
  "reason": "The image shows a pizza with salami slices, which is exactly what the advertised product 'Steinofen Genuss Pizza Salami' is."
 },
 "usage": {
  "calls": 1,
  "input_tokens": 2353,
  "output_tokens": 215,
  "thinking_tokens": 312
 },
 "recorded_at": "2026-10-09T09:15:46+00:00"
}