{
 "purpose": "vision",
 "model_id": "gemini-3.1-flash-lite",
 "response": {
  "depicted_object": "A rectangular package of roasted coffee beans, featuring a gold-colored background and an illustration of coffee beans at the bottom.",
  "depicted_category": "Coffee",
  "advertised_category": "Coffee",
  "matches": "yes",
  "confidence": 1,
  "reason": "The image shows a package of coffee, which directly corresponds to the advertised product 'Goldkrone Röstkaffee'."
 },
 "usage": {
  "calls": 1,
  "input_tokens": 4739,
  "output_tokens": 382,
  "thinking_tokens": 202
 },
 "recorded_at": "2026-10-09T09:14:10+00:00"
}